{
  "schemaVersion": "0.2.0",
  "planSha256": "4acfe9a5a5702f03ec8b87f9ffc63cee5a85863bf7150db1f85bf70c65b896ae",
  "artifactSha256": "ddafdf6cdfcec575aa549a69eb83c7ce61236c53108e1d894656170fd67bb470",
  "renderer": {
    "name": "standards-ui-workflow-render",
    "version": "0.2.0",
    "supportManifestSha256": "5a53493085f8761f7a8a1f3b983b47fae8bb37e032cd1d821cbbdb41ba9dd4ab",
    "sourceSha256": "51b0f200b69064ff5ca1f0bfa80929a38f4e4323a9ffad8223effcd5dc2624a8",
    "packageVersion": "2.0.0",
    "packageEntrySha256": "d4759c898ac2e4c407827cfd24b411331b18ad4694eca3a89fa245f43fd2638b",
    "tokensSha256": "988884d837fed375bed377219f93ba9078fc6211abee218ca3ef5a4546ec247b",
    "fontAssetsSha256": "9abaec92be36ac7220c17a086a1b0f5fe4ce4eaf8eef41381ee0dd7986472746",
    "runtimeModulesSha256": "f72bdaf5672dbec88d108c2f8d273f2620854e5a2a3683ad41a6c805058ea270",
    "lockfileSha256": "6af6db9351d85ee3ffd79c55facfe96fe9693a20dc5c627d0cb89774870dec46",
    "browserLauncherSha256": "8319963f6625accf51c0dd4f55091ceaf9f09ed39e7a52fed4fae12b2a6b668a",
    "browserPayloadSha256": "d17d20831fa431481e389a5b92db808835c37dc8ca260ab61f64033dfb9cf3c5",
    "nodeExecutableSha256": "27db838bb204ef7c21df2931f5656e4c8fb32e6e947f363a402b49714d32b5b1",
    "browserRevision": "1243",
    "browser": "153.0.8010.12",
    "platform": "darwin-arm64",
    "nodeVersion": "v24.19.0"
  },
  "viewports": [
    {
      "width": 320,
      "height": 844,
      "document": {
        "clientWidth": 320,
        "clientHeight": 844,
        "scrollWidth": 320,
        "scrollHeight": 844
      },
      "bodyTextLength": 181,
      "overflowingElements": [],
      "facts": [
        {
          "id": "title",
          "text": "Change narrow acceptance",
          "visible": true,
          "clipped": false,
          "occluded": false,
          "contrastRatio": 18.883,
          "lineCount": 1,
          "bounds": {
            "x": 16,
            "y": 7.844,
            "width": 166.719,
            "height": 15
          }
        },
        {
          "id": "series.label",
          "text": "Qualified opportunities",
          "visible": true,
          "clipped": false,
          "occluded": false,
          "contrastRatio": 5.329,
          "lineCount": 1,
          "bounds": {
            "x": 16,
            "y": 65,
            "width": 166.984,
            "height": 14
          }
        },
        {
          "id": "series.zero",
          "text": "0",
          "visible": true,
          "clipped": false,
          "occluded": false,
          "contrastRatio": 5.329,
          "lineCount": 1,
          "bounds": {
            "x": 33.391,
            "y": 243.906,
            "width": 6.609,
            "height": 14
          }
        },
        {
          "id": "series.periods.0.period",
          "text": "Q1",
          "visible": true,
          "clipped": false,
          "occluded": false,
          "contrastRatio": 5.329,
          "lineCount": 1,
          "bounds": {
            "x": 70.391,
            "y": 313.5,
            "width": 13.203,
            "height": 14
          }
        },
        {
          "id": "series.periods.0.display",
          "text": "−12",
          "visible": true,
          "clipped": false,
          "occluded": false,
          "contrastRatio": 18.883,
          "lineCount": 1,
          "bounds": {
            "x": 66.188,
            "y": 330,
            "width": 21.609,
            "height": 16
          }
        },
        {
          "id": "series.periods.1.period",
          "text": "Q2",
          "visible": true,
          "clipped": false,
          "occluded": false,
          "contrastRatio": 5.329,
          "lineCount": 1,
          "bounds": {
            "x": 136.391,
            "y": 313.5,
            "width": 13.203,
            "height": 14
          }
        },
        {
          "id": "series.periods.1.display",
          "text": "0",
          "visible": true,
          "clipped": false,
          "occluded": false,
          "contrastRatio": 18.883,
          "lineCount": 1,
          "bounds": {
            "x": 139.391,
            "y": 330,
            "width": 7.203,
            "height": 16
          }
        },
        {
          "id": "series.periods.2.period",
          "text": "Q3",
          "visible": true,
          "clipped": false,
          "occluded": false,
          "contrastRatio": 5.329,
          "lineCount": 1,
          "bounds": {
            "x": 202.391,
            "y": 313.5,
            "width": 13.203,
            "height": 14
          }
        },
        {
          "id": "series.periods.2.display",
          "text": "+18",
          "visible": true,
          "clipped": false,
          "occluded": false,
          "contrastRatio": 18.883,
          "lineCount": 1,
          "bounds": {
            "x": 198.188,
            "y": 330,
            "width": 21.609,
            "height": 16
          }
        },
        {
          "id": "series.periods.3.period",
          "text": "Q4",
          "visible": true,
          "clipped": false,
          "occluded": false,
          "contrastRatio": 5.329,
          "lineCount": 1,
          "bounds": {
            "x": 268.391,
            "y": 313.5,
            "width": 13.203,
            "height": 14
          }
        },
        {
          "id": "series.periods.3.display",
          "text": "+31",
          "visible": true,
          "clipped": false,
          "occluded": false,
          "contrastRatio": 18.883,
          "lineCount": 1,
          "bounds": {
            "x": 264.188,
            "y": 330,
            "width": 21.609,
            "height": 16
          }
        },
        {
          "id": "series.summary.0.term",
          "text": "Net change",
          "visible": true,
          "clipped": false,
          "occluded": false,
          "contrastRatio": 5.329,
          "lineCount": 1,
          "bounds": {
            "x": 16,
            "y": 402.5,
            "width": 66,
            "height": 14
          }
        },
        {
          "id": "series.summary.0.value",
          "text": "+43",
          "visible": true,
          "clipped": false,
          "occluded": false,
          "contrastRatio": 18.883,
          "lineCount": 1,
          "bounds": {
            "x": 16,
            "y": 419,
            "width": 28.813,
            "height": 21
          }
        },
        {
          "id": "series.summary.1.term",
          "text": "Current total",
          "visible": true,
          "clipped": false,
          "occluded": false,
          "contrastRatio": 5.329,
          "lineCount": 1,
          "bounds": {
            "x": 130,
            "y": 402.5,
            "width": 85.813,
            "height": 14
          }
        },
        {
          "id": "series.summary.1.value",
          "text": "31",
          "visible": true,
          "clipped": false,
          "occluded": false,
          "contrastRatio": 18.883,
          "lineCount": 1,
          "bounds": {
            "x": 130,
            "y": 419,
            "width": 19.203,
            "height": 21
          }
        },
        {
          "id": "series.note",
          "text": "Signed values exercise both sides of the visible zero baseline.",
          "visible": true,
          "clipped": false,
          "occluded": false,
          "contrastRatio": 5.329,
          "lineCount": 2,
          "bounds": {
            "x": 16,
            "y": 476,
            "width": 259.656,
            "height": 37
          }
        },
        {
          "id": "series.current",
          "text": "Current",
          "visible": true,
          "clipped": false,
          "occluded": false,
          "contrastRatio": 18.883,
          "lineCount": 1,
          "bounds": {
            "x": 258,
            "y": 353,
            "width": 42,
            "height": 13
          }
        }
      ],
      "unmarkedText": [],
      "invariantBand": {
        "count": 1,
        "containsTitle": true,
        "bounds": {
          "x": 0,
          "y": 0,
          "width": 320,
          "height": 32
        },
        "backgroundColor": "rgb(17, 17, 17)",
        "titleColor": "rgb(255, 255, 255)",
        "borderWidths": {
          "top": 0,
          "right": 0,
          "bottom": 0,
          "left": 0
        }
      },
      "semanticChecks": {
        "move": "Series",
        "oneVisibleH1": true,
        "relationships": [
          {
            "id": "series.period-order",
            "passed": true
          },
          {
            "id": "series.value-association",
            "passed": true
          }
        ]
      },
      "pageErrors": [],
      "blockedRequests": [],
      "screenshot": {
        "file": "series-320-320x844.png",
        "sha256": "51f0ea1af1667ed205b297fd15de60781775d82111760f2fa967781fa64cc478",